{
  "schema_version": 1,
  "tool": {
    "name": "appstore-review-guardian",
    "version": "0.1.0"
  },
  "generated_at": "2026-10-17T00:27:24Z",
  "mode": "gate",
  "disclaimer": "Este relatório é uma auditoria preventiva automatizada. READY significa apenas que nenhuma falha bloqueante foi encontrada nas verificações executadas; não é garantia nem probabilidade de aprovação pela Apple. A decisão final é sempre do App Review.",
  "target": {
    "project": "/private/tmp/asrg-examples/flutter_app",
    "ipa": "/private/tmp/asrg-examples/Example-unsigned.ipa [UNSIGNED — não serve para upload; assinatura/perfil não verificáveis]",
    "app_name": "Example App",
    "bundle_id": "com.example.app",
    "version": "2.0.1",
    "build": "7",
    "ipa_sha256": "bfec74c224c9e2f58ae9915d2b29871a9a74d0fc0e5b992935f2eb5ddf81983e",
    "facts": {
      "project": {
        "project": "flutter_app",
        "flutter": true,
        "ios_dir": "ios",
        "release_settings": {
          "PRODUCT_BUNDLE_IDENTIFIER": "com.example.app",
          "CODE_SIGN_ENTITLEMENTS": "Runner/Runner.entitlements",
          "CODE_SIGN_STYLE": null,
          "CODE_SIGN_IDENTITY": null,
          "IPHONEOS_DEPLOYMENT_TARGET": null,
          "INFOPLIST_FILE": "Runner/Info.plist"
        },
        "deployment_targets": {
          "project Release": "15.0",
          "Podfile platform": "15.0"
        },
        "info": {
          "bundle_id": "com.example.app",
          "CFBundleShortVersionString": "2.0.1",
          "CFBundleVersion": "7",
          "ITSAppUsesNonExemptEncryption": false,
          "UIBackgroundModes": [
            "remote-notification"
          ],
          "url_schemes": [],
          "usage_descriptions": [
            "NSPhotoLibraryUsageDescription"
          ]
        },
        "version": "2.0.1",
        "build": "7",
        "bundle_id": "com.example.app",
        "name": "demo",
        "entitlements": {
          "keys": [
            "aps-environment",
            "com.apple.developer.applesignin"
          ],
          "aps-environment": "development",
          "get-task-allow": null,
          "associated_domains": [],
          "sign_in_with_apple": true
        },
        "export_method": "app-store-connect",
        "app_privacy_manifest": {
          "component": "app",
          "file": "/private/tmp/asrg-examples/flutter_app/ios/Runner/PrivacyInfo.xcprivacy",
          "valid": true,
          "tracking": false,
          "tracking_domains": [],
          "api_categories": {
            "NSPrivacyAccessedAPICategoryUserDefaults": [
              "CA92.1"
            ],
            "NSPrivacyAccessedAPICategoryFileTimestamp": [
              "C617.1"
            ]
          },
          "collected": [
            "NSPrivacyCollectedDataTypeEmailAddress"
          ]
        },
        "dependencies": {
          "flutter_sdk_constraint": ">=3.24.0",
          "dart_sdk_constraint": ">=3.5.0 <4.0.0",
          "ios_plugins": [],
          "pods": {
            "Flutter": "1.0.0",
            "FirebaseMessaging": "11.0.0"
          },
          "listed_sdks_present": [
            "FirebaseMessaging",
            "Flutter"
          ],
          "direct_dependencies": [
            "flutter",
            "image_picker",
            "firebase_messaging",
            "google_sign_in",
            "sign_in_with_apple"
          ]
        },
        "code_signals": {
          "social_login_code": 1,
          "apple_login_code": 1,
          "account_creation_code": 1,
          "account_deletion_code": 1,
          "privacy_policy_code": 1
        }
      },
      "bundle": {
        "ipa": "Example-unsigned.ipa",
        "size": 3236,
        "payload_apps": [
          "Runner.app"
        ],
        "has_swift_support": false,
        "has_symbols_dir": false,
        "extracted_members": 8,
        "app": "Runner.app",
        "frameworks": [
          {
            "name": "App",
            "has_privacy_manifest": false,
            "archs": [
              "arm64"
            ]
          },
          {
            "name": "Flutter",
            "has_privacy_manifest": true,
            "archs": [
              "arm64"
            ]
          }
        ],
        "extensions": [],
        "privacy_manifests": [
          {
            "path": "Frameworks/Flutter.framework/PrivacyInfo.xcprivacy",
            "valid": true,
            "categories": [
              "NSPrivacyAccessedAPICategoryFileTimestamp",
              "NSPrivacyAccessedAPICategoryUserDefaults"
            ],
            "tracking": false
          },
          {
            "path": "PrivacyInfo.xcprivacy",
            "valid": true,
            "categories": [
              "NSPrivacyAccessedAPICategoryFileTimestamp",
              "NSPrivacyAccessedAPICategoryUserDefaults"
            ],
            "tracking": false
          }
        ],
        "archs": [
          "arm64"
        ],
        "debug_artifacts": [],
        "flutter_debug": false,
        "info": {
          "bundle_id": "com.example.app",
          "CFBundleShortVersionString": "2.0.1",
          "CFBundleVersion": "7",
          "MinimumOSVersion": "15.0",
          "DTXcode": "2641",
          "DTSDKName": "iphoneos26.4",
          "DTPlatformVersion": "26.4",
          "DTXcodeBuild": null,
          "ITSAppUsesNonExemptEncryption": false,
          "UIBackgroundModes": [
            "remote-notification"
          ],
          "url_schemes": [],
          "usage_descriptions": [
            "NSCameraUsageDescription",
            "NSPhotoLibraryUsageDescription"
          ]
        },
        "name": "Example App",
        "main_platform": "ios",
        "linked_frameworks": [
          "UIKit"
        ],
        "required_reason_symbols": {
          "NSPrivacyAccessedAPICategorySystemBootTime": [
            "Runner:_mach_absolute_time"
          ]
        },
        "signing": {
          "signed": false,
          "authority": [],
          "profile": null,
          "tools": {}
        }
      },
      "artifact_label": "UNSIGNED",
      "asc": {
        "metadata_supplied": false,
        "api_credentials": {
          "ASC_KEY_ID": false,
          "ASC_ISSUER_ID": false,
          "ASC_KEY_PATH": false,
          "key_file_exists": false
        }
      }
    }
  },
  "rules": {
    "count": 72,
    "rules_consulted_at": "2026-10-16",
    "rules_age_days": 0,
    "sources_cache": null
  },
  "environment": {
    "platform": "darwin",
    "python": "3.12.13",
    "tools": {
      "codesign": true,
      "security": true,
      "otool": true,
      "lipo": true,
      "plutil": true
    },
    "network": false
  },
  "sections": {
    "technical": {
      "label": "AUDITORIA TÉCNICA",
      "status": "BLOCKED",
      "counts": {
        "BLOCKER": 1,
        "CRITICAL": 0,
        "WARNING": 1,
        "INFO": 1,
        "PASS": 26,
        "NOT_VERIFIED": 5,
        "NOT_APPLICABLE": 0
      }
    },
    "privacy": {
      "label": "CONFORMIDADE DE PRIVACIDADE",
      "status": "WARNING",
      "counts": {
        "BLOCKER": 0,
        "CRITICAL": 0,
        "WARNING": 1,
        "INFO": 0,
        "PASS": 17,
        "NOT_VERIFIED": 3,
        "NOT_APPLICABLE": 1
      }
    },
    "app_review": {
      "label": "CONFORMIDADE APP REVIEW",
      "status": "PASS_WITH_PENDING",
      "counts": {
        "BLOCKER": 0,
        "CRITICAL": 0,
        "WARNING": 0,
        "INFO": 0,
        "PASS": 1,
        "NOT_VERIFIED": 5,
        "NOT_APPLICABLE": 0
      }
    },
    "submission": {
      "label": "APP STORE CONNECT / SUBMISSÃO",
      "status": "PASS_WITH_PENDING",
      "counts": {
        "BLOCKER": 0,
        "CRITICAL": 0,
        "WARNING": 0,
        "INFO": 0,
        "PASS": 2,
        "NOT_VERIFIED": 13,
        "NOT_APPLICABLE": 0
      }
    }
  },
  "readiness": {
    "note": "Indicadores de prontidão = proporção de verificações executadas que passaram (conformity) e proporção de verificações que puderam ser executadas (coverage). Não são probabilidade de aprovação.",
    "technical": {
      "label": "Conformidade técnica",
      "conformity_pct": 93,
      "coverage_pct": 84,
      "executed": 27,
      "not_verified": 5,
      "blocking": 1
    },
    "apple_guidelines": {
      "label": "Conformidade com diretrizes Apple",
      "conformity_pct": 95,
      "coverage_pct": 70,
      "executed": 19,
      "not_verified": 8,
      "blocking": 0
    },
    "submission_preparation": {
      "label": "Preparação da submissão",
      "conformity_pct": 100,
      "coverage_pct": 13,
      "executed": 2,
      "not_verified": 13,
      "blocking": 0
    }
  },
  "final_status": "BLOCKED",
  "gate_reasons": [
    "BLOCKER SIGN-001: Bundle assinado (_CodeSignature)"
  ],
  "counts": {
    "BLOCKER": 1,
    "CRITICAL": 0,
    "WARNING": 2,
    "INFO": 1,
    "PASS": 46,
    "NOT_VERIFIED": 26,
    "NOT_APPLICABLE": 1
  },
  "pending": [
    {
      "finding_id": "F051",
      "rule_id": "REV-ACCTDEL-001",
      "title": "Exclusão de conta no app",
      "reason": "criação de conta [\"auth/auth.dart:3: Future<void> signUp() async { await api.post('/auth/register'); }\"]; indício de exclusão [\"auth/auth.dart:6: Future<void> deleteAccount() async { await api.delete(",
      "gate_relevant": true
    },
    {
      "finding_id": "F052",
      "rule_id": "REV-IAP-001",
      "title": "Compras de conteúdo digital via In-App Purchase",
      "reason": "sem IAP nem pagamento externo detectados (ausência heurística não prova N/A)",
      "gate_relevant": true
    },
    {
      "finding_id": "F053",
      "rule_id": "REV-LOGIN-001",
      "title": "Login social e alternativa equivalente",
      "reason": "login social: deps=['google_sign_in'] código=['auth/auth.dart:4: final g = GoogleSignIn();']; indício de alternativa Sign in with Apple: deps=['sign_in_with_apple'] código=['auth/auth.dart:5: Future<v",
      "gate_relevant": true
    },